[
  {
    "id": "comedy_the_turd_ferguson_equation",
    "title": "The Giant Hat Disruption Equation",
    "canonicalTitle": "The Turd Ferguson Equation",
    "alternateTitles": [
      "The Turd Ferguson Equation",
      "affectionate SNL Celebrity Jeopardy homage origin"
    ],
    "family": "comedy",
    "familyLabel": "Comedy",
    "formula": "TF = ((H x M x S) + W^2 + C) / (R + F)",
    "formulaLatex": "TF = ((H \\times M \\times S) + W^{2} + C) / (R + F)",
    "formulaPlaintext": "TF equals  open parenthesis open parenthesis H times M times S close parenthesis  plus W squared plus C close parenthesis  divided by  open parenthesis R plus F close parenthesis ",
    "formulaSymbols": [
      "TF",
      "H",
      "M",
      "S",
      "W",
      "C",
      "R",
      "F"
    ],
    "variables": [
      {
        "symbol": "TF",
        "meaning": "Turd Ferguson Output",
        "role": "output"
      },
      {
        "symbol": "H",
        "meaning": "Hat Coefficient",
        "role": "amplifier"
      },
      {
        "symbol": "M",
        "meaning": "Mustache Confidence",
        "role": "amplifier"
      },
      {
        "symbol": "S",
        "meaning": "Smirk Constant",
        "role": "amplifier"
      },
      {
        "symbol": "W",
        "meaning": "Wrong Answer Velocity",
        "role": "amplifier"
      },
      {
        "symbol": "C",
        "meaning": "Chaos Injection",
        "role": "amplifier"
      },
      {
        "symbol": "R",
        "meaning": "Respect for Rules",
        "role": "buffer"
      },
      {
        "symbol": "F",
        "meaning": "Format Integrity",
        "role": "buffer"
      }
    ],
    "tagline": "Big hat + wrong confidence + zero format respect = legendary disruption.",
    "derivation": "The equation is an intentionally symbolic design pattern: amplifying forces are placed above or before the operator, while stabilizing forces provide buffering, context, or repair.",
    "theoreticalEcho": "comedy timing, incongruity, callback structure, and rule-of-three craft. This is an influence/analogy note, not a scientific validation claim.",
    "culturalScope": "Drafted from a Western/English-language comedy, drama, game-design, and reflective-writing context; not universal and not clinical.",
    "temporalNote": "A static symbolic snapshot of a dynamic process; future versions may add temporal and relational state models.",
    "reflectionPrompt": "What invisible rule or format is being gloriously violated, and how does the audience response become part of the bit?",
    "useCases": [
      "creative writing",
      "NPC emotion design",
      "story/dialogue design",
      "comedy/sketch craft"
    ],
    "exampleApplication": "A contestant keeps answering with impossible confidence while the host tries to preserve order; the joke lands because format respect drops while commitment rises.",
    "crossReferences": [
      "comedy_the_callback_loop",
      "comedy_the_authority_collapse_formula",
      "drama_the_overreaction_theorem"
    ],
    "posterVisual": "Featured cowboy-hat cameo, game-show podium, host irritation chart, oversized hat arrows.",
    "visualMotif": "marquee bulbs, fake lab stickers, timing clocks, giant hat chaos",
    "familyColor": "#E2A93B",
    "boundaryNote": "Symbolic craft pattern only; not measurement.",
    "misuseWarning": "Do not use this as a cruelty machine or conflict-escalation manual. The project is for craft, play, reflection, and humane storytelling.",
    "intensity": "medium",
    "version": "0.3.0",
    "createdDate": "2026-05-31",
    "status": "draft-v0.3",
    "license": "CC BY 4.0 recommended for formula text/data; poster art may use separate terms."
  },
  {
    "id": "comedy_the_deadpan_delta",
    "title": "The Deadpan Delta",
    "canonicalTitle": "The Deadpan Delta",
    "alternateTitles": [],
    "family": "comedy",
    "familyLabel": "Comedy",
    "formula": "D = A / E",
    "formulaLatex": "D = A / E",
    "formulaPlaintext": "D equals A divided by E",
    "formulaSymbols": [
      "D",
      "A",
      "E"
    ],
    "variables": [
      {
        "symbol": "D",
        "meaning": "Deadpan Power",
        "role": "output"
      },
      {
        "symbol": "A",
        "meaning": "Absurdity",
        "role": "amplifier"
      },
      {
        "symbol": "E",
        "meaning": "Emotional Reaction",
        "role": "buffer"
      }
    ],
    "tagline": "Say the wildest thing like you are reading a parking receipt.",
    "derivation": "The ratio form frames the numerator as the pressure source and the denominator as the reality-check or emotional display that regulates it.",
    "theoreticalEcho": "comedy timing, incongruity, callback structure, and rule-of-three craft. This is an influence/analogy note, not a scientific validation claim.",
    "culturalScope": "Drafted from a Western/English-language comedy, drama, game-design, and reflective-writing context; not universal and not clinical.",
    "temporalNote": "A static symbolic snapshot of a dynamic process; future versions may add temporal and relational state models.",
    "reflectionPrompt": "What makes this funny: surprise, timing, specificity, confidence, or the refusal to respect the format?",
    "useCases": [
      "creative writing",
      "NPC emotion design",
      "story/dialogue design",
      "comedy/sketch craft"
    ],
    "exampleApplication": "Use this card to sharpen a sketch beat, NPC gag, or dialogue turn without making cruelty the engine.",
    "crossReferences": [
      "drama_the_suspicious_silence_delta",
      "comedy_the_social_contract_violation_index",
      "drama_the_social_contract_violation_index"
    ],
    "posterVisual": "Neutral face icon beside absurd object.",
    "visualMotif": "marquee bulbs, fake lab stickers, timing clocks, giant hat chaos",
    "familyColor": "#E2A93B",
    "boundaryNote": "Symbolic craft pattern only; not measurement.",
    "misuseWarning": "Do not use this as a cruelty machine or conflict-escalation manual. The project is for craft, play, reflection, and humane storytelling.",
    "intensity": "medium",
    "version": "0.3.0",
    "createdDate": "2026-05-31",
    "status": "draft-v0.3",
    "license": "CC BY 4.0 recommended for formula text/data; poster art may use separate terms."
  },
  {
    "id": "comedy_the_escalation_spiral",
    "title": "The Escalation Spiral",
    "canonicalTitle": "The Escalation Spiral",
    "alternateTitles": [],
    "family": "comedy",
    "familyLabel": "Comedy",
    "formula": "C = J x 3^R",
    "formulaLatex": "C = J \\times 3^{R}",
    "formulaPlaintext": "C equals J times 3 to the power of R",
    "formulaSymbols": [
      "C",
      "J",
      "R"
    ],
    "variables": [
      {
        "symbol": "C",
        "meaning": "Comedy Intensity",
        "role": "output"
      },
      {
        "symbol": "J",
        "meaning": "Joke Seed",
        "role": "amplifier"
      },
      {
        "symbol": "R",
        "meaning": "Repetition Rounds",
        "role": "amplifier"
      }
    ],
    "tagline": "Round 3: society collapses around the bit.",
    "derivation": "The exponential term represents a symbolic threshold effect: each retelling or repetition does not merely add force, it changes the social weather of the scene.",
    "theoreticalEcho": "comedy timing, incongruity, callback structure, and rule-of-three craft. This is an influence/analogy note, not a scientific validation claim.",
    "culturalScope": "Drafted from a Western/English-language comedy, drama, game-design, and reflective-writing context; not universal and not clinical.",
    "temporalNote": "A static symbolic snapshot of a dynamic process; future versions may add temporal and relational state models.",
    "reflectionPrompt": "What makes this funny: surprise, timing, specificity, confidence, or the refusal to respect the format?",
    "useCases": [
      "creative writing",
      "NPC emotion design",
      "story/dialogue design",
      "comedy/sketch craft"
    ],
    "exampleApplication": "Use this card to sharpen a sketch beat, NPC gag, or dialogue turn without making cruelty the engine.",
    "crossReferences": [
      "comedy_the_rule_of_three_detonation",
      "drama_the_rule_of_three_retellings"
    ],
    "posterVisual": "Spiral arrow growing into an explosion.",
    "visualMotif": "marquee bulbs, fake lab stickers, timing clocks, giant hat chaos",
    "familyColor": "#E2A93B",
    "boundaryNote": "Symbolic craft pattern only; not measurement.",
    "misuseWarning": "Do not use this as a cruelty machine or conflict-escalation manual. The project is for craft, play, reflection, and humane storytelling.",
    "intensity": "medium",
    "version": "0.3.0",
    "createdDate": "2026-05-31",
    "status": "draft-v0.3",
    "license": "CC BY 4.0 recommended for formula text/data; poster art may use separate terms."
  },
  {
    "id": "comedy_the_confidence_to_wrongness_ratio",
    "title": "The Confidence-to-Wrongness Ratio",
    "canonicalTitle": "The Confidence-to-Wrongness Ratio",
    "alternateTitles": [],
    "family": "comedy",
    "familyLabel": "Comedy",
    "formula": "F = K / A",
    "formulaLatex": "F = K / A",
    "formulaPlaintext": "F equals K divided by A",
    "formulaSymbols": [
      "F",
      "K",
      "A"
    ],
    "variables": [
      {
        "symbol": "F",
        "meaning": "Funny Output",
        "role": "output"
      },
      {
        "symbol": "K",
        "meaning": "Confidence",
        "role": "amplifier"
      },
      {
        "symbol": "A",
        "meaning": "Accuracy",
        "role": "buffer"
      }
    ],
    "tagline": "Fake expert energy.",
    "derivation": "The ratio form frames the numerator as the pressure source and the denominator as the reality-check or emotional display that regulates it.",